{
  "event": "approval.requested",
  "event_id": "evt_01J0APPROVAL00000000000001",
  "created_at": "2026-06-02T12:00:01+08:00",
  "data": {
    "approval_id": "apr_01J0APPROVAL00000000000001",
    "action": "message.send",
    "requested_by": {
      "actor_type": "agent",
      "actor_id": "agt_01J0ALICE0000000000000001",
      "owner_user_id": "usr_01J0ALICE0000000000000001"
    },
    "owner": {
      "actor_type": "user",
      "actor_id": "usr_01J0ALICE0000000000000001"
    },
    "reason": "sensitive_content",
    "status": "pending",
    "created_at": "2026-06-02T12:00:01+08:00",
    "expires_at": "2026-06-02T12:10:01+08:00"
  }
}

