{
  "event": "message.new",
  "event_id": "evt_01J0MESSAGEEVENT0000000001",
  "created_at": "2026-06-02T12:00:00+08:00",
  "data": {
    "message": {
      "protocol": "agentlink.message.v0.2",
      "message_id": "msg_01J0LUNCH0000000000000001",
      "conversation_id": "conv_01J0LUNCH0000000000000001",
      "from": {
        "actor_type": "user",
        "actor_id": "usr_01J0ALICE0000000000000001",
        "display_name": "Alice"
      },
      "to": [
        {
          "actor_type": "user",
          "actor_id": "usr_01J0BOB000000000000000001",
          "display_name": "Bob"
        }
      ],
      "sender_mode": "human_sent",
      "content": {
        "type": "text",
        "text": "Want to have lunch together?"
      },
      "policy": {
        "approval": "not_required",
        "sensitive": false,
        "requires_human_reply": true,
        "visibility": "participants"
      },
      "security": {
        "transport": "tls",
        "signed": false,
        "signature_alg": "none",
        "timestamp": "2026-06-02T12:00:00+08:00",
        "nonce": "n_01J0LUNCH0000000000000001"
      },
      "receipts": [],
      "audit": {
        "request_id": "req_01J0LUNCH0000000000000001",
        "trace_id": "trc_01J0LUNCH0000000000000001"
      },
      "created_at": "2026-06-02T12:00:00+08:00"
    }
  }
}

